{
  "$schema": "https://json-schema.org/draft/2020-12/schema",
  "$id": "https://weaver-spec.dev/contracts/v0/extended/skill_card.schema.json",
  "title": "SkillCard",
  "description": "Extended. A reusable procedure/skill derived from traces and approved for reuse. The lifecycle_state gates activation; steps and preconditions describe how and when to apply the skill.",
  "type": "object",
  "required": ["skill_id", "name", "description", "created_at"],
  "properties": {
    "skill_id": {
      "type": "string",
      "minLength": 1,
      "description": "Unique identifier for this skill."
    },
    "name": {
      "type": "string",
      "minLength": 1,
      "description": "Short human-readable name."
    },
    "description": {
      "type": "string",
      "minLength": 1,
      "description": "What the skill does."
    },
    "created_at": {
      "type": "string",
      "format": "date-time",
      "description": "ISO 8601 timestamp of when the skill was created."
    },
    "lifecycle_state": {
      "type": "string",
      "enum": ["draft", "in_review", "active", "deprecated"],
      "description": "Lifecycle state; activation requires passing through review."
    },
    "steps": {
      "type": "array",
      "items": { "type": "string" },
      "description": "Ordered steps describing how to apply the skill."
    },
    "preconditions": {
      "type": "array",
      "items": { "type": "string" },
      "description": "Conditions that must hold before applying the skill."
    },
    "scope": {
      "type": ["string", "null"],
      "description": "Optional reuse scope, e.g. repo, team, org, global."
    },
    "sensitivity": {
      "type": "string",
      "enum": ["public", "internal", "confidential", "restricted"],
      "description": "Sensitivity level governing how the skill may be surfaced."
    },
    "source_refs": {
      "type": "array",
      "items": { "type": "string" },
      "description": "References to the traces/memory the skill was derived from (provenance)."
    },
    "expires_at": {
      "type": ["string", "null"],
      "description": "Optional ISO 8601 expiry timestamp."
    },
    "provenance": {
      "type": "object",
      "description": "Optional structured provenance.",
      "additionalProperties": true
    },
    "metadata": {
      "type": "object",
      "description": "Optional implementation-specific metadata.",
      "additionalProperties": true
    }
  },
  "additionalProperties": true
}
